<?xml version="1.0"?>
<simulation xmlns:xsi="http://www.w3.org/2001/XMLSchema-instance"
            xsi:noNamespaceSchemaLocation="../src/xsd/Simulation.xsd">

    <cuboid>
        <position>
            <x>0.0</x>
            <y>0.0</y>
            <z>0.0</z>
        </position>
        <velocity>
            <v>0.0</v>
            <w>0.0</w>
            <z>0.0</z>
        </velocity>
        <mass>1.0</mass>
        <grid>
            <Nx>40</Nx>
            <Ny>8</Ny>
            <Nz>1</Nz>
        </grid>
        <spacing>1.1225</spacing>
        <type>1</type>
    </cuboid>

    <cuboid>
        <position>
            <x>15.0</x>
            <y>15.0</y>
            <z>0.0</z>
        </position>
        <velocity>
            <v>0.0</v>
            <w>-10.0</w>
            <z>0.0</z>
        </velocity>
        <mass>1.0</mass>
        <grid>
            <Nx>8</Nx>
            <Ny>8</Ny>
            <Nz>1</Nz>
        </grid>
        <spacing>1.1225</spacing>
        <type>2</type>
    </cuboid>
</simulation>
